{
  "id": "urn:fair:music-002",
  "title": "Temporal Beats",
  "context": "Music",
  "contributors": [
    {
      "actor": { "id": "did:ethr:0xProducerWallet", "name": "Producer Z" },
      "role": "production",
      "temporal_splits": [
        {
          "version": 1,
          "effective_from": "2025-04-01T00:00:00Z",
          "conditions": ["pre-recoup"],
          "description": "Initial split before recouping $5000 production costs",
          "weight": 0.5
        },
        {
          "version": 2,
          "effective_from": "2025-04-01T00:00:00Z",
          "conditions": ["post-recoup"],
          "description": "Adjusted split after recouping $5000 production costs",
          "weight": 0.2
        }
      ]
    },
    {
      "actor": { "id": "did:ethr:0xArtistWallet", "name": "Artist A" },
      "role": "performance",
      "temporal_splits": [
        {
          "version": 1,
          "effective_from": "2025-04-01T00:00:00Z",
          "conditions": ["pre-recoup"],
          "description": "Initial split before recouping $5000 production costs",
          "weight": 0.5
        },
        {
          "version": 2,
          "effective_from": "2025-04-01T00:00:00Z",
          "conditions": ["post-recoup"],
          "description": "Adjusted split after recouping $5000 production costs",
          "weight": 0.8
        }
      ]
    }
  ],
  "metadata": {
    "recoup_threshold": {
      "amount": 5000,
      "currency": "USD",
      "description": "Production costs to be recouped before split changes"
    },
    "default_condition": "pre-recoup"
  },
  "created_by": "did:ethr:0xProducerWallet",
  "created_at": "2025-04-01T10:00:00Z",
  "updated_at": "2025-04-01T10:00:00Z",
  "tags": ["music", "temporal", "recoup"]
}

