{
  "id": "urn:fair:track-001",
  "title": "Midnight Echo",
  "context": "Music Track",
  "contributors": [
    {
      "actor": { "id": "did:ethr:0xAliceWallet", "name": "Alice Chen" },
      "role": "producer",
      "weight": 0.3
    },
    {
      "actor": { "id": "did:ethr:0xBobWallet", "name": "Bob Johnson" },
      "role": "vocalist",
      "weight": 0.3
    },
    {
      "actor": { "id": "did:ethr:0xCarolWallet", "name": "Carol Martinez" },
      "role": "songwriter",
      "weight": 0.2
    },
    {
      "actor": { "id": "did:ethr:0xDaveWallet", "name": "Dave Williams" },
      "role": "guitarist",
      "weight": 0.1
    },
    {
      "actor": { "id": "did:ethr:0xEveWallet", "name": "Eve Taylor" },
      "role": "mixing engineer",
      "weight": 0.1
    }
  ],
  "created_by": "did:ethr:0xAliceWallet",
  "created_at": "2025-03-15T14:30:00Z",
  "tags": ["electronic", "vocal", "indie", "collaboration"]
}

