{
  "id": "urn:fair:project-002",
  "title": "Digital Art Collective: Future Visions",
  "context": "Multi-disciplinary Project",
  "contributors": [
    {
      "actor": { "id": "did:ethr:0xStudioXYZ", "name": "Studio XYZ" },
      "role": "project management",
      "weight": 0.15
    },
    {
      "actor": { "id": "did:ethr:0xMikaWallet", "name": "Mika Yamamoto" },
      "role": "visual artist",
      "weight": 0.25
    },
    {
      "actor": { "id": "did:ethr:0xJackWallet", "name": "Jack Rivera" },
      "role": "sound designer",
      "weight": 0.2
    },
    {
      "actor": { "ref": "urn:fair:track-001" },
      "role": "featured music",
      "weight": 0.2
    },
    {
      "actor": { "id": "did:ethr:0xSofiaWallet", "name": "Sofia Patel" },
      "role": "creative director",
      "weight": 0.2
    }
  ],
  "created_by": "did:ethr:0xStudioXYZ",
  "created_at": "2025-04-01T09:15:00Z",
  "tags": ["digital art", "multimedia", "exhibition", "collaborative"]
}

