{
  "id": "urn:fair:music-001",
  "title": "Original Track",
  "context": "Music",
  "contributors": [
    {
      "actor": { "id": "did:ethr:0xComposerWallet", "name": "Composer X" },
      "role": "composition",
      "weight": 0.6
    },
    {
      "actor": { "id": "did:ethr:0xVocalistWallet", "name": "Vocalist Y" },
      "role": "vocals",
      "weight": 0.4
    }
  ],
  "created_by": "did:ethr:0xComposerWallet",
  "created_at": "2025-04-10T10:00:00Z",
  "tags": ["music", "original"]
}
